{
  "profileId": "spotcomp-player-character-boundary-candidate",
  "taxonomy": {
    "distinctPositions": [
      "external-player",
      "modeled-player",
      "character",
      "persona",
      "role",
      "skill",
      "method-or-tool",
      "cgs-strategy"
    ],
    "externalPlayerIsNotModel": true,
    "characterIsPlayerKindNotPlayerDefinition": true,
    "personaScopesRoles": true,
    "rolesBundleSkills": true,
    "skillsInvokeMethodsOrTools": true,
    "evidence": [
      "lab/hacking/.../computing/spotcomp/settling/library/player/player.schema.json",
      "lab/archive/multi-user-dungeon/tab/docs/2026-03-11/agent-hierarchy.md"
    ]
  },
  "externalModelBoundary": {
    "externalPlayerRef": "external:alice",
    "modeledPlayerRef": "player:alice",
    "playerKind": "character",
    "systemHoldsSettling": true,
    "externalEntityNotMutatedByModel": true,
    "settlingRepresentsModel": true,
    "evidence": [
      "lab/hacking/.../computing/spotcomp/settling/library/player/player.schema.json",
      "MODELED-PLAYERS.md"
    ]
  },
  "characterLayer": {
    "requiredWhenPlayerKindIsCharacter": true,
    "characterRef": "character:alice",
    "personaRef": "persona:alice",
    "roleRefs": ["role:trace-settler"],
    "identitySurface": "identity:key:alice",
    "memorySurface": "trace:memory/alice",
    "governanceSurface": "governance:example",
    "teachingDistinctFromInstallation": true,
    "installationDistinctFromPlayerBinding": true,
    "evidence": [
      "development/active/.../agentic-systems/library/character/character.schema.json",
      "lab/archive/doing/working/hacking/doing/working/planning/library/task/library/characters-as-cells/characters-as-cells.md",
      "lab/hacking/.../predicate-category/hacking/teaching/teaching.md"
    ]
  },
  "skillOperatorLayer": {
    "skillsAreTypedOperators": true,
    "skillFirstPolicy": true,
    "operatorsMonotone": true,
    "operatorsClosureCompatible": true,
    "operatorsFragmentPreserving": true,
    "failureMonotone": true,
    "skillImprovementIsClosure": true,
    "skills": [
      {
        "id": "skill:append-trace",
        "roleRef": "role:trace-settler",
        "capabilityBound": "capability:append-own-outbox",
        "methodOrToolSurface": "tool:trace-append",
        "evidence": [
          "lab/archive/.../agential-semioverse/agential-semioverse.md",
          "lab/archive/.../agent-skill-interaction.md"
        ]
      }
    ]
  },
  "localSettlingLayer": {
    "localSettlingRef": "local-settling:player:alice",
    "boundedRestrictionOfUniversalSettling": true,
    "observationFrontierRef": "frontier:alice:observable",
    "actionBoundRef": "action-bound:alice",
    "capabilityFiberRef": "capability-fiber:alice",
    "governanceRef": "governance:example",
    "epistemicProfileRef": "epistemic-profile:alice",
    "normativeProfileRef": "norm-regime:alice",
    "sigmaDeltaCommutationDeclared": true,
    "evidence": [
      "development/active/.../local-settling/docs/dev/journal/2026-05-24.md",
      "lab/archive/.../docs/math/structure/agent.md"
    ]
  },
  "cgsBinding": {
    "cgsProfileRef": "example-cgs-modeled-player",
    "strategyRef": "strategy:alice",
    "observationMapRef": "observation-map:alice",
    "opponentEventsFromObservations": true,
    "playerEventsFromActions": true,
    "polarityNotIdentity": true,
    "symmetryQuotientRef": "sym:delivery-order",
    "evidence": [
      "CGS-EMBEDDING.md",
      "lab/hacking/.../computing/code/structures/cgs.md"
    ]
  },
  "implementationBoundary": {
    "identifierKeyInboxOutboxInsufficient": true,
    "mustDeclareLocalSettling": true,
    "mustDeclareCharacterBindingForCharacterKind": true,
    "mustDeclareHandedness": true,
    "mustDeclareGovernanceAndCapabilities": true,
    "mustDeclareCgsStrategy": true,
    "mustPreserveTeachingInstallationBindingDistinction": true,
    "evidence": [
      "PLAYER-CHARACTER-BOUNDARY.md",
      "AGENTIC-EMBEDDING.md",
      "MODELED-PLAYERS.md"
    ]
  },
  "openObligations": [
    "prove skill admissibility for each declared skill operator",
    "prove local settling is a bounded restriction of universal settling",
    "prove CGS receptivity and strategy composition for the bound player"
  ],
  "evidence": [
    "PLAYER-CHARACTER-BOUNDARY.md",
    "DERIVATION-OBLIGATIONS.md D9"
  ]
}
